{
  "request_id": "ER-000042",
  "request_type": "REPOSITORY_AUDIT",
  "target": {
    "type": "REPOSITORY",
    "id": "https://github.com/langchain-ai/langgraph"
  },
  "scope": {
    "depth": 3,
    "include_artifacts": true,
    "include_provenance": true,
    "filters": {
      "min_confidence": 0.7,
      "classification_types": ["observable", "derivable"],
      "date_range": {
        "from": "2026-01-01T00:00:00Z",
        "to": "2026-07-30T23:59:59Z"
      }
    }
  },
  "context": {
    "research_domain": "software engineering",
    "tags": ["langgraph", "python", "sdk", "bugfixes"],
    "notes": "Audit dependency updates and bug fixes for evidence quality analysis"
  },
  "created_at": "2026-07-30T18:00:00Z",
  "requested_by": "external_agent_demo"
}